{
  "schema_version": 1,
  "plan": "docs/superpowers/plans/2026-09-04-show-kit-forge.md",
  "branch": "codex/show-kit-forge-complete",
  "base_commit": "0b77f9fef019dbfe1da943019b339bd446f95725",
  "status": "software_verified_hardware_blocked",
  "phase": "pr",
  "workstreams": {
    "a4_evidence_codec": "verified",
    "domain_readiness": "verified",
    "storage_workspace_websocket": "verified",
    "frontend": "verified",
    "documentation_learning": "verified",
    "final_closeout": "in_progress",
    "studio_hardware_validation": "blocked"
  },
  "verification": {
    "focused_checks": {
      "a4_renderer": "Canonical calibration metadata, exact shared Q8.8 codec, drift rejection, hash-pinned fixtures and unknown-byte isolation pass. Inert A4 preparation remains permanently blocked for output.",
      "domain_readiness": "64/96 identifier bounds and maximum-revision catalog import roundtrip pass; canonical validators/reasons/registry domains, source protection, stale evidence and bounded diagnostics have regressions.",
      "import_direction": "All801 architecture cases pass; root data exports are constants only, and workspace owns MutationScope construction.",
      "documentation": "Architecture/operator/build prose and diagrams reviewed; build-only variables indexed, relative links checked and resumable schema validates."
    },
    "final_gate_counts": {
      "cockpit_python": "2763 passed,4 skipped in22.61s before three final logging regressions; final full suite covers those regressions.",
      "frontend": "809 tests/62files,100% statements3269/branches2455/functions1125/lines2943; typecheck/lint/build pass. Playwright21passed/2existing skips in50.2s, disabled/fake MIDI; screenshots inspected.",
      "fast_suite": "8238 passed,5skipped in200.93s before three final logging regressions; final full suite covers those regressions.",
      "architecture": "801 cases pass in final full run; pre-push hook repeats the dedicated gate.",
      "v134_parity": "685 cases pass in final full run; all505 frozen JSON fixtures unchanged; hook repeats the dedicated gate.",
      "full_suite": "8926 passed,5skipped in272.28s on local Windows/Python3.12.14.",
      "touched_coverage": "32 production modules,6458 statements/1558 branches,100% lines and branches. Whole-package pure branch99.3597%; ratchet99% passes unchanged.",
      "static_analysis": "Ruff/new-module PLR+ERA+ARG,Black,isort,Vulture whole-package70/touched80,strict Pyright1.1.411 on32modules,diff,state/schema pass.",
      "hosted_ci": "Current SHA-specific CI/build/smoke receipts are maintained on PR238; required human re-review is not bypassed."
    }
  },
  "pull_request_url": "https://github.com/buzzijose-hub/RytmRandomizer/pull/238",
  "hardware_validation": {
    "a4_offline_candidate": "verified_offline_only",
    "a4_send": "prohibited",
    "a4_physical_scratch_return": "blocked",
    "rytm_one_pad_send_restore": "blocked",
    "paired_favorite_recapture_preflight": "blocked",
    "checklist": "docs/hardware-validation/2026-09-04-show-kit-forge-studio-checklist.md",
    "observations_recorded": false
  },
  "pending_closeout_fields": [
    "identified_studio_build",
    "hosted_ci",
    "required_review"
  ],
  "next_action": "Push existing PR238 through hooks, bind all8 scoped reviews to that SHA, request maintainer re-review, build/download/hash-verify and smoke the identified Windows artifact with MIDI off. Preserve physical evidence gates.",
  "resume": {
    "read_first": [
      "docs/superpowers/plans/2026-09-04-show-kit-forge.md",
      "docs/2026-09-07-show-kit-forge-review-reconciliation.md",
      "docs/superpowers/plans/2026-09-04-show-kit-forge_STATE.json",
      "docs/superpowers/plans/2026-09-04-show-kit-forge_RUN_REPORT.md",
      "docs/2026-09-04-show-kit-forge_RUN_LOG.md",
      "docs/AUTONOMOUS_RUN_PLAYBOOK.md"
    ],
    "reconcile": "Inspect the current working tree and GitHub PR state, compare them with this file, then run only the next eligible serialized closeout step. Never infer hardware observations."
  },
  "last_event": {
    "at": "2026-09-07T17:10:09.026895+00:00",
    "summary": "Maintainer repairs and final local checks pass. Hosted checks, identified studio build and required re-review remain to be reconciled."
  },
  "last_updated_at": "2026-09-07T17:10:09.026895+00:00"
}
